[
  { "slug": "maurizio-massari", "name": "Maurizio Massari", "role": "Permanent Representative of the Italian Republic to the United Nations", "organization": "Permanent Mission of Italy to the United Nations", "organization_slug": "italy-permanent-mission", "country": "Italy", "provenance": { "source_url": "https://www.un.org/digital-emerging-technologies/sites/www.un.org.techenvoy/files/UN_Open_Source_Week_Conference_Report_2025.pdf", "source_title": "UN Open Source Week 2025 Conference Report (RISE 2026:04)", "license": "CC-BY-4.0", "attribution": "Sachiko Muto, RISE / OpenForum Europe", "retrieved": "2026-06-29", "method": "manual-extraction", "locator": "Opening Plenary keynote" } },
  { "slug": "jayantha-jayasuriya", "name": "Jayantha Jayasuriya", "role": "Permanent Representative of the Democratic Socialist Republic of Sri Lanka to the United Nations", "organization": "Permanent Mission of Sri Lanka to the United Nations", "organization_slug": "sri-lanka-permanent-mission", "country": "Sri Lanka", "provenance": { "source_url": "https://www.un.org/digital-emerging-technologies/sites/www.un.org.techenvoy/files/UN_Open_Source_Week_Conference_Report_2025.pdf", "source_title": "UN Open Source Week 2025 Conference Report (RISE 2026:04)", "license": "CC-BY-4.0", "attribution": "Sachiko Muto, RISE / OpenForum Europe", "retrieved": "2026-06-29", "method": "manual-extraction", "locator": "Opening Plenary" } },
  { "slug": "mehdi-snene", "name": "Mehdi Snene", "role": "Senior Advisor for AI and Digital Transformation", "organization": "UN Office for Digital and Emerging Technologies (ODET)", "organization_slug": "un-odet", "provenance": { "source_url": "https://www.un.org/digital-emerging-technologies/sites/www.un.org.techenvoy/files/UN_Open_Source_Week_Conference_Report_2025.pdf", "source_title": "UN Open Source Week 2025 Conference Report (RISE 2026:04)", "license": "CC-BY-4.0", "attribution": "Sachiko Muto, RISE / OpenForum Europe", "retrieved": "2026-06-29", "method": "manual-extraction", "locator": "LinkedIn Side Event; Breaking Silos panel" } },
  { "slug": "sarah-steinberg", "name": "Sarah Steinberg", "role": "Head of Global Public Policy Partnerships", "organization": "LinkedIn", "organization_slug": "linkedin", "provenance": { "source_url": "https://www.un.org/digital-emerging-technologies/sites/www.un.org.techenvoy/files/UN_Open_Source_Week_Conference_Report_2025.pdf", "source_title": "UN Open Source Week 2025 Conference Report (RISE 2026:04)", "license": "CC-BY-4.0", "attribution": "Sachiko Muto, RISE / OpenForum Europe", "retrieved": "2026-06-29", "method": "manual-extraction", "locator": "LinkedIn Side Event" } },
  { "slug": "craig-ramlal", "name": "Craig Ramlal", "role": "Head of the Control Systems Group", "organization": "University of the West Indies", "country": "Trinidad and Tobago", "provenance": { "source_url": "https://www.un.org/digital-emerging-technologies/sites/www.un.org.techenvoy/files/UN_Open_Source_Week_Conference_Report_2025.pdf", "source_title": "UN Open Source Week 2025 Conference Report (RISE 2026:04)", "license": "CC-BY-4.0", "attribution": "Sachiko Muto, RISE / OpenForum Europe", "retrieved": "2026-06-29", "method": "manual-extraction", "locator": "LinkedIn Side Event" } },
  { "slug": "armando-manzueta", "name": "Armando José Manzueta Peña", "role": "Vice Minister for Public Innovation and Digital", "organization": "Government of the Dominican Republic", "organization_slug": "dominican-republic-government", "country": "Dominican Republic", "provenance": { "source_url": "https://www.un.org/digital-emerging-technologies/sites/www.un.org.techenvoy/files/UN_Open_Source_Week_Conference_Report_2025.pdf", "source_title": "UN Open Source Week 2025 Conference Report (RISE 2026:04)", "license": "CC-BY-4.0", "attribution": "Sachiko Muto, RISE / OpenForum Europe", "retrieved": "2026-06-29", "method": "manual-extraction", "locator": "LinkedIn Side Event; DPI Day smaller-states breakout" } },
  { "slug": "lucia-velasco", "name": "Lucia Velasco", "role": "Senior Advisor", "organization": "UN Office for Digital and Emerging Technologies (ODET)", "organization_slug": "un-odet", "provenance": { "source_url": "https://www.un.org/digital-emerging-technologies/sites/www.un.org.techenvoy/files/UN_Open_Source_Week_Conference_Report_2025.pdf", "source_title": "UN Open Source Week 2025 Conference Report (RISE 2026:04)", "license": "CC-BY-4.0", "attribution": "Sachiko Muto, RISE / OpenForum Europe", "retrieved": "2026-06-29", "method": "manual-extraction", "locator": "LinkedIn Side Event (Moderator)" } },
  { "slug": "nicholas-gates", "name": "Nicholas Gates", "role": "Senior Policy Advisor", "organization": "OpenForum Europe (OFE)", "organization_slug": "openforum-europe", "provenance": { "source_url": "https://www.un.org/digital-emerging-technologies/sites/www.un.org.techenvoy/files/UN_Open_Source_Week_Conference_Report_2025.pdf", "source_title": "UN Open Source Week 2025 Conference Report (RISE 2026:04)", "license": "CC-BY-4.0", "attribution": "Sachiko Muto, RISE / OpenForum Europe", "retrieved": "2026-06-29", "method": "manual-extraction", "locator": "Day 2 Breakout 1 (Moderator); Program Committee" } },
  { "slug": "amandine-le-pape", "name": "Amandine Le Pape", "role": "COO and Co-Founder, Element; Co-founder, Matrix.org Foundation", "organization": "Element", "organization_slug": "element", "provenance": { "source_url": "https://www.un.org/digital-emerging-technologies/sites/www.un.org.techenvoy/files/UN_Open_Source_Week_Conference_Report_2025.pdf", "source_title": "UN Open Source Week 2025 Conference Report (RISE 2026:04)", "license": "CC-BY-4.0", "attribution": "Sachiko Muto, RISE / OpenForum Europe", "retrieved": "2026-06-29", "method": "manual-extraction", "locator": "Day 2 Breakout 1" } },
  { "slug": "david-cuartielles", "name": "David Cuartielles", "role": "Co-founder, Arduino; Senior Lecturer, Malmö University", "organization": "Arduino / Malmö University", "country": "Sweden", "provenance": { "source_url": "https://www.un.org/digital-emerging-technologies/sites/www.un.org.techenvoy/files/UN_Open_Source_Week_Conference_Report_2025.pdf", "source_title": "UN Open Source Week 2025 Conference Report (RISE 2026:04)", "license": "CC-BY-4.0", "attribution": "Sachiko Muto, RISE / OpenForum Europe", "retrieved": "2026-06-29", "method": "manual-extraction", "locator": "Day 2 Breakout 1" } },
  { "slug": "sachiko-muto", "name": "Sachiko Muto", "role": "Senior Researcher, RISE; Chair, OpenForum Europe", "organization": "RISE Research Institutes of Sweden", "organization_slug": "rise", "country": "Sweden", "provenance": { "source_url": "https://www.un.org/digital-emerging-technologies/sites/www.un.org.techenvoy/files/UN_Open_Source_Week_Conference_Report_2025.pdf", "source_title": "UN Open Source Week 2025 Conference Report (RISE 2026:04)", "license": "CC-BY-4.0", "attribution": "Sachiko Muto, RISE / OpenForum Europe", "retrieved": "2026-06-29", "method": "manual-extraction", "locator": "Report author; Day 2 Breakout 1; Day 3 OSPO panel (Moderator); Program Committee" } },
  { "slug": "walid-mathlouthi", "name": "Walid Mathlouthi", "role": "Representative", "organization": "International Telecommunication Union (ITU)", "organization_slug": "itu", "provenance": { "source_url": "https://www.un.org/digital-emerging-technologies/sites/www.un.org.techenvoy/files/UN_Open_Source_Week_Conference_Report_2025.pdf", "source_title": "UN Open Source Week 2025 Conference Report (RISE 2026:04)", "license": "CC-BY-4.0", "attribution": "Sachiko Muto, RISE / OpenForum Europe", "retrieved": "2026-06-29", "method": "manual-extraction", "locator": "Day 2 Breakout 1" } },
  { "slug": "stefano-maffulli", "name": "Stefano Maffulli", "role": "Executive Director", "organization": "Open Source Initiative (OSI)", "organization_slug": "osi", "provenance": { "source_url": "https://www.un.org/digital-emerging-technologies/sites/www.un.org.techenvoy/files/UN_Open_Source_Week_Conference_Report_2025.pdf", "source_title": "UN Open Source Week 2025 Conference Report (RISE 2026:04)", "license": "CC-BY-4.0", "attribution": "Sachiko Muto, RISE / OpenForum Europe", "retrieved": "2026-06-29", "method": "manual-extraction", "locator": "Day 2 Breakout 2 (OSAID v1.0)" } },
  { "slug": "amreen-taneja", "name": "Amreen Taneja", "role": "DPG Standard Lead", "organization": "Digital Public Goods Alliance (DPGA)", "organization_slug": "dpga", "provenance": { "source_url": "https://www.un.org/digital-emerging-technologies/sites/www.un.org.techenvoy/files/UN_Open_Source_Week_Conference_Report_2025.pdf", "source_title": "UN Open Source Week 2025 Conference Report (RISE 2026:04)", "license": "CC-BY-4.0", "attribution": "Sachiko Muto, RISE / OpenForum Europe", "retrieved": "2026-06-29", "method": "manual-extraction", "locator": "Day 2 Breakout 2 (DPG Standard)" } },
  { "slug": "omar-mohsine", "name": "Omar Mohsine", "role": "Open Source Coordinator", "organization": "UN Office of Information and Communications Technology (OICT)", "organization_slug": "un-oict", "provenance": { "source_url": "https://www.un.org/digital-emerging-technologies/sites/www.un.org.techenvoy/files/UN_Open_Source_Week_Conference_Report_2025.pdf", "source_title": "UN Open Source Week 2025 Conference Report (RISE 2026:04)", "license": "CC-BY-4.0", "attribution": "Sachiko Muto, RISE / OpenForum Europe", "retrieved": "2026-06-29", "method": "manual-extraction", "locator": "Day 3 Opening Keynotes (MC); Acknowledgements" } },